<?xml version="1.0" encoding="UTF-8" standalone="no"?>
<execution xmlns:xsi="http://www.w3.org/2001/XMLSchema-instance" xsi:noNamespaceSchemaLocation="execution.xsd">
  <NMSmodel>
     <type>
        <hybrid>
            <alpha> 1 </alpha>
              <beta> 2 </beta>
              <gamma> 3 </gamma> 
              <trackedMuscles> 
                               recfem_r vasmed_r vaslat_r vasint_r bicfemsh_r 
                               gmin1_r gmin2_r gmin3_r gmed1_r gmed2_r gmed3_r 
                               tfl_r addbrev_r addlong_r addmag1_r addmag2_r 
                               addmag3_r gra_r sar_r semiten_r semimem_r bicfemlh_r 
                               gmax1_r gmax2_r gmax3_r gaslat_r gasmed_r sol_r perlong_r 
                               tibant_r perter_r perbrev_r  
              </trackedMuscles>
              <predictedMuscles> psoas_r illiacus_r</predictedMuscles> 
              <algorithm>
                   <simulatedAnnealing>
                        <noEpsilon>4</noEpsilon>
                        <rt>0.3</rt>
                        <T>20</T>
                        <NS>15</NS>
                        <NT>5</NT>
                        <epsilon>1.E-3</epsilon>
                        <maxNoEval>200000</maxNoEval>
                   </simulatedAnnealing>
              </algorithm>
        </hybrid>
     </type>

     <tendon>
          <stiff/>
     </tendon>

     <activation>
          <exponential/>
     </activation>
  </NMSmodel>

  <online/>

  <samplingFrequency>
  200
  </samplingFrequency>

  <elaboratedDoFs>
     PugnoFotonico AlabardaSpaziale 
  </elaboratedDoFs>

  <logging>
     <txt/>
  </logging>


</execution>
