<?xml version="1.0" encoding="UTF-8" standalone="no" ?>
<execution xmlns:xsi="http://www.w3.org/2001/XMLSchema-instance" xsi:noNamespaceSchemaLocation="execution.xsd">

  <NMSmodel>
    <type>
      <openLoop/>
    </type>
    <tendon>
      <stiff/>
    </tendon>
    <activation>
      <exponential/>
    </activation>
  </NMSmodel>

  <offline/>

</execution>
